{
  "$schema": "../../../packages/contract/schema/game-manifest.schema.json",
  "id": "tap-merge",
  "name": "Chạm Ghép",
  "version": "0.8.0",
  "protocol": 1,
  "description": "Chạm vào một khối số: cả chuỗi khối giống nó nối liền nhau, cả đường chéo, nhập lại. Gom càng nhiều, số càng to!",
  "icon": "icon.svg",
  "orientation": "portrait",
  "capabilities": ["save", "scores", "shell"],
  "themes": ["light", "dark"],
  "minAge": 3,
  "tags": ["puzzle", "numbers"],
  "sizeBudgetKb": 2500
}
