{
  "$schema": "../../../packages/contract/schema/game-manifest.schema.json",
  "id": "merge-block",
  "name": "Ghép Khối",
  "version": "1.8.1",
  "protocol": 1,
  "description": "Thả khối số vào cột, hai khối giống nhau sẽ gộp lại. Gộp liên tiếp để nhân điểm!",
  "icon": "icon.svg",
  "orientation": "portrait",
  "capabilities": ["save", "scores", "shell"],
  "themes": ["light", "dark"],
  "minAge": 3,
  "tags": ["puzzle", "numbers"],
  "sizeBudgetKb": 2500
}
